{
  "schemaVersion": 1,
  "eventType": "DEVICE_STATUS",
  "deviceId": "esp32-bench",
  "bootId": "11111111-1111-4111-8111-111111111111",
  "statusSeq": 1,
  "uptimeMs": 500,
  "replyToProbeId": "22222222-2222-4222-8222-222222222222",
  "controlWindow": {
    "windowId": "22222222-2222-4222-8222-222222222222",
    "validForMs": 10000
  },
  "state": "IDLE",
  "sessionId": null,
  "sampleCount": 0,
  "finalized": false,
  "round": 0,
  "attempt": 0,
  "controlMode": "MQTT",
  "controlReady": true,
  "fault": null,
  "commandResult": null,
  "lastExecution": null,
  "lastRelease": null
}
